{
  "knowledge_id": "SOIL_ECOLOGY_CATTLE_INTERPRETATION_001",
  "topic": "soil_ecology",
  "statement": "Soil and ecological-site context helps interpret vegetation potential and wetness risk. Drainage class, hydrologic group, map unit, and available water are interpretive context, not proof of forage yield or stocking rate. Point soil samples are not parcel-wide composition unless spatial semantics say PARCEL.",
  "source_id": "SRC_SOIL_DEMO_001",
  "source_title": "Soil/ecology interpretation for cattle natural foundation (Demo-approved)",
  "source_url_or_citation": "docs/RANGEMATCH_PRODUCT_AND_AGENT_CODE_FLOW.md",
  "source_publisher": "RangeMatch Demo knowledge card",
  "source_date": "2026-08-15",
  "reviewed_by": "RangeMatch Demo review",
  "reviewed_at": "2026-08-15",
  "review_basis": "Demo-approved cattle natural-environment interpretation limit.",
  "effective_jurisdictions": [
    "US_GENERAL"
  ],
  "species_scope": [
    "cattle"
  ],
  "review_status": "APPROVED",
  "allowed_use": [
    "domain_prior",
    "diligence_question",
    "conditional_reasoning"
  ],
  "prohibited_use": [
    "parcel_fact",
    "suitability_verdict",
    "legal_conclusion",
    "stocking_advice"
  ],
  "expires_or_review_after": "2026-11-15",
  "version": "0.1-demo",
  "content_hash": "sha256:66bf319e524e6f3faeefd6ecd99552884478e39d4c567cd776ff17fec7a52061"
}
